{
  "$schema": "https://json-schema.org/draft/2020-12/schema",
  "$id": "https://example.invalid/isaac-audio-sensors/s4_8_recovery_amendment_02_denominators.v2.schema.json",
  "title": "S4.8 Recovery Amendment 02 37-take denominator adaptation",
  "type": "object",
  "additionalProperties": false,
  "required": [
    "schema",
    "status",
    "source_criteria_register_path",
    "source_criteria_register_sha256",
    "thresholds_unchanged",
    "comparators_unchanged",
    "tiers_unchanged",
    "applicability_unchanged",
    "metric_role_amendment",
    "planned_take_denominator",
    "planned_denominator_policy",
    "stratum_take_denominators",
    "derived_denominators",
    "direction_metric_denominators",
    "criterion_expected_count_overrides",
    "unchanged_non_null_expected_counts",
    "null_window_or_metric_denominators_remain_null"
  ],
  "properties": {
    "schema": {"const": "ias.s4_8.recovery_amendment_02_denominators.v2"},
    "status": {"const": "prepared_not_frozen"},
    "source_criteria_register_path": {
      "const": "outputs/isaac_audio_sensors/S4/S4.7_corrective_03/criteria_register.json"
    },
    "source_criteria_register_sha256": {
      "const": "64e9fc170e81174f975d5d67b7ce94b765f967b3826e5e7cd61746ab59e25375"
    },
    "thresholds_unchanged": {"const": true},
    "comparators_unchanged": {"const": true},
    "tiers_unchanged": {"const": false},
    "applicability_unchanged": {"const": false},
    "metric_role_amendment": {
      "const": {
        "primary_metric": "squadbot_categorical_direction_accuracy",
        "primary_metric_threshold": 0.75,
        "categorical_direction_role": "primary_gating",
        "continuous_bearing_error_role": "diagnostic_non_gating",
        "continuous_bearing_diagnostic_criteria": [
          "bearing_median_absolute_error_stratum_a",
          "bearing_p95_absolute_error_stratum_a",
          "bearing_worst_absolute_error_stratum_a",
          "bearing_median_absolute_error_stratum_b",
          "within_cell_bearing_circular_range_stratum_a",
          "sim_adjusted_bearing_median_delta_vs_real",
          "bearing_median_absolute_error_stratum_a_stretch",
          "bearing_p95_absolute_error_stratum_a_stretch",
          "sim_adjusted_bearing_median_delta_vs_real_stretch"
        ],
        "superseded_sector_criteria": [
          "sector_accuracy_stratum_b",
          "sector_accuracy_stratum_b_stretch"
        ]
      }
    },
    "planned_take_denominator": {"const": 37},
    "planned_denominator_policy": {"const": "all_37_planned_takes_retained"},
    "stratum_take_denominators": {
      "type": "object",
      "additionalProperties": false,
      "required": [
        "A_controlled_boundary_sweep",
        "B_center_nominal_level",
        "C_center_low_level",
        "D_silence",
        "E_impact_audio_video",
        "A_plus_B"
      ],
      "properties": {
        "A_controlled_boundary_sweep": {"const": 24},
        "B_center_nominal_level": {"const": 4},
        "C_center_low_level": {"const": 4},
        "D_silence": {"const": 3},
        "E_impact_audio_video": {"const": 2},
        "A_plus_B": {"const": 28}
      }
    },
    "derived_denominators": {
      "type": "object",
      "additionalProperties": false,
      "required": [
        "raw_channel_take_records",
        "direction_bearing_cells",
        "direction_bearing_cell_pair_groups",
        "product_low_gain_pairs"
      ],
      "properties": {
        "raw_channel_take_records": {"const": 148},
        "direction_bearing_cells": {"const": 8},
        "direction_bearing_cell_pair_groups": {"const": 48},
        "product_low_gain_pairs": {"const": 4}
      }
    },
    "direction_metric_denominators": {
      "const": {
        "primary_applicable_takes": 28,
        "front_expected_takes": 7,
        "right_expected_takes": 10,
        "left_expected_takes": 7,
        "rear_unavailable_expected_takes": 4,
        "low_volume_diagnostic_takes": 4,
        "silence_unavailable_takes": 3,
        "impact_direction_not_applicable_takes": 2
      }
    },
    "criterion_expected_count_overrides": {
      "const": {
        "bearing_median_absolute_error_stratum_b": 4,
        "sector_accuracy_stratum_b": 4,
        "candidate_coverage_strata_ab": 28,
        "frame_to_adapter_latency_p95": 37,
        "capture_to_frame_offline_spread": 37,
        "raw_channel_health_failure_count": 148,
        "major_polarity_anomaly_count": 148,
        "sustained_clipping_take_count": 37,
        "maximum_clip_run_samples": 37,
        "take_failure_rate": 37,
        "confidence_median_stratum_b": 4,
        "low_level_confidence_monotonicity": 4,
        "coarse_av_association_residual_stratum_e": 2,
        "sim_adjusted_bearing_median_delta_vs_real": 28,
        "sector_accuracy_stratum_b_stretch": 4,
        "candidate_coverage_strata_ab_stretch": 28,
        "sim_adjusted_bearing_median_delta_vs_real_stretch": 28
      }
    },
    "unchanged_non_null_expected_counts": {
      "const": {
        "bearing_median_absolute_error_stratum_a": 24,
        "bearing_p95_absolute_error_stratum_a": 24,
        "bearing_worst_absolute_error_stratum_a": 24,
        "within_cell_bearing_circular_range_stratum_a": 8,
        "within_cell_pair_tdoa_range_stratum_a": 48,
        "bearing_median_absolute_error_stratum_a_stretch": 24,
        "bearing_p95_absolute_error_stratum_a_stretch": 24
      }
    },
    "null_window_or_metric_denominators_remain_null": {
      "const": [
        "silence_abstention_rate_stratum_d",
        "active_abstention_rate_strata_ab",
        "sub_floor_direction_emission_count",
        "sim_adjustment_worsened_gating_metric_count",
        "active_abstention_rate_strata_ab_stretch"
      ]
    }
  }
}
